{
  "schema_version": 1,
  "generation": 42,
  "issued_at": "2026-08-27T10:00:00Z",
  "expires_at": "2026-08-28T10:00:00Z",
  "min_client_version": "0.1.0",
  "network": {
    "id": "xworkmate-private",
    "address": "172.29.10.100/32",
    "dns": []
  },
  "wireguard": {
    "peers": [
      {
        "node_id": "xworkmate-bridge",
        "public_key": "1staGq8lmHFRFRFNj2QOFx/MPxb/1fFV4tawC6xSi1Q=",
        "allowed_ips": ["172.29.10.0/24"],
        "endpoint": "127.0.0.1:51830"
      }
    ]
  },
  "transport": {
    "proxy_core": "xray",
    "type": "vless-tls-xudp",
    "host": "xworkmate-bridge.svc.plus",
    "port": 2443,
    "credential_ref": "sealed:fixture"
  },
  "policy": {
    "revision": 7,
    "artifact_hash": "sha256:fixture-policy",
    "rules": []
  },
  "signature": {
    "key_id": "overlay-config-2026-01",
    "algorithm": "Ed25519",
    "value": "fixture-signature"
  }
}
